Time,Source,Destination,Protocol,Length,Info
0,192.168.1.9,99.86.129.122,TLSv1.2,97,Encrypted Alert
0.000167,192.168.1.9,99.86.129.122,TCP,66,"52827  >  443 [FIN, ACK] Seq=32 Ack=1 Win=2048 Len=0 TSval=1073993741 TSecr=377740628"
0.027513,99.86.129.122,192.168.1.9,TCP,66,"443  >  52827 [FIN, ACK] Seq=1 Ack=32 Win=122 Len=0 TSval=377752221 TSecr=1073993741"
0.027611,192.168.1.9,99.86.129.122,TCP,66,"[TCP Retransmission] 52827  >  443 [FIN, ACK] Seq=32 Ack=2 Win=2048 Len=0 TSval=1073993768 TSecr=377752221"
0.033517,99.86.129.122,192.168.1.9,TCP,66,443  >  52827 [ACK] Seq=2 Ack=33 Win=122 Len=0 TSval=377752221 TSecr=1073993741
0.540951,192.168.1.9,172.217.14.234,UDP,65,56287  >  443 Len=23
0.591881,172.217.14.234,192.168.1.9,UDP,62,443  >  56287 Len=20
0.774933,67.202.110.21,192.168.1.9,TLSv1.2,90,Application Data
0.77494,67.202.110.21,192.168.1.9,TCP,66,"443  >  53219 [FIN, ACK] Seq=25 Ack=1 Win=31961 Len=0 TSval=3732358321 TSecr=1073984706"
0.775054,192.168.1.9,67.202.110.21,TCP,66,53219  >  443 [ACK] Seq=1 Ack=25 Win=65535 Len=0 TSval=1073994511 TSecr=3732358321
0.775055,192.168.1.9,67.202.110.21,TCP,66,53219  >  443 [ACK] Seq=1 Ack=26 Win=65535 Len=0 TSval=1073994511 TSecr=3732358321
0.775307,192.168.1.9,67.202.110.21,TLSv1.2,90,Application Data
0.775507,192.168.1.9,67.202.110.21,TCP,66,"53219  >  443 [FIN, ACK] Seq=25 Ack=26 Win=65535 Len=0 TSval=1073994511 TSecr=3732358321"
0.841646,67.202.110.21,192.168.1.9,TCP,54,443  >  53219 [RST] Seq=26 Win=0 Len=0
0.84165,67.202.110.21,192.168.1.9,TCP,54,443  >  53219 [RST] Seq=26 Win=0 Len=0
0.909903,192.168.1.9,74.125.195.189,UDP,65,64096  >  443 Len=23
0.939623,74.125.195.189,192.168.1.9,UDP,64,443  >  64096 Len=22
1.378766,192.168.1.9,198.23.90.60,TLSv1.2,97,Encrypted Alert
1.378911,192.168.1.9,198.23.90.60,TCP,66,"52809  >  443 [FIN, ACK] Seq=32 Ack=1 Win=2048 Len=0 TSval=1073995112 TSecr=2551433311"
1.42167,198.23.90.60,192.168.1.9,TCP,66,"443  >  52809 [FIN, ACK] Seq=1 Ack=33 Win=7 Len=0 TSval=2551553363 TSecr=1073995112"
1.4218,192.168.1.9,198.23.90.60,TCP,66,52809  >  443 [ACK] Seq=33 Ack=2 Win=2048 Len=0 TSval=1073995155 TSecr=2551553363
1.679495,192.168.1.9,198.23.90.62,TLSv1.2,97,Encrypted Alert
1.679667,192.168.1.9,198.23.90.62,TCP,66,"52813  >  443 [FIN, ACK] Seq=32 Ack=1 Win=2048 Len=0 TSval=1073995411 TSecr=2468965613"
1.719935,198.23.90.62,192.168.1.9,TCP,66,"443  >  52813 [FIN, ACK] Seq=1 Ack=32 Win=7 Len=0 TSval=2469085661 TSecr=1073995411"
1.719941,198.23.90.62,192.168.1.9,TCP,66,443  >  52813 [ACK] Seq=2 Ack=33 Win=7 Len=0 TSval=2469085661 TSecr=1073995411
1.720089,192.168.1.9,198.23.90.62,TCP,66,"[TCP Retransmission] 52813  >  443 [FIN, ACK] Seq=32 Ack=2 Win=2048 Len=0 TSval=1073995451 TSecr=2469085661"
1.836006,104.254.148.166,192.168.1.9,TLSv1.2,97,Encrypted Alert
1.836013,104.254.148.166,192.168.1.9,TCP,66,"443  >  53229 [FIN, ACK] Seq=32 Ack=1 Win=99 Len=0 TSval=4273030448 TSecr=1073985725"
1.836125,192.168.1.9,104.254.148.166,TCP,66,53229  >  443 [ACK] Seq=1 Ack=32 Win=2047 Len=0 TSval=1073995566 TSecr=4273030448
1.836126,192.168.1.9,104.254.148.166,TCP,66,53229  >  443 [ACK] Seq=1 Ack=33 Win=2047 Len=0 TSval=1073995566 TSecr=4273030448
1.836367,192.168.1.9,104.254.148.166,TLSv1.2,97,Encrypted Alert
1.836575,192.168.1.9,104.254.148.166,TCP,66,"53229  >  443 [FIN, ACK] Seq=32 Ack=33 Win=2048 Len=0 TSval=1073995566 TSecr=4273030448"
1.863964,104.254.148.166,192.168.1.9,TLSv1.2,97,Encrypted Alert
1.863979,104.254.148.166,192.168.1.9,TCP,66,"443  >  53223 [FIN, ACK] Seq=32 Ack=1 Win=167 Len=0 TSval=4273030455 TSecr=1073985749"
1.864084,192.168.1.9,104.254.148.166,TCP,66,53223  >  443 [ACK] Seq=1 Ack=32 Win=2047 Len=0 TSval=1073995593 TSecr=4273030455
1.86411,192.168.1.9,104.254.148.166,TCP,66,53223  >  443 [ACK] Seq=1 Ack=33 Win=2047 Len=0 TSval=1073995593 TSecr=4273030455
1.864255,192.168.1.9,104.254.148.166,TLSv1.2,97,Encrypted Alert
1.864511,192.168.1.9,104.254.148.166,TCP,66,"53223  >  443 [FIN, ACK] Seq=32 Ack=33 Win=2048 Len=0 TSval=1073995593 TSecr=4273030455"
1.866105,104.254.148.166,192.168.1.9,TLSv1.2,97,Encrypted Alert
1.866112,104.254.148.166,192.168.1.9,TCP,66,"443  >  53227 [FIN, ACK] Seq=32 Ack=1 Win=111 Len=0 TSval=4273030456 TSecr=1073985750"
1.866202,192.168.1.9,104.254.148.166,TCP,66,53227  >  443 [ACK] Seq=1 Ack=32 Win=2047 Len=0 TSval=1073995595 TSecr=4273030456
1.86624,192.168.1.9,104.254.148.166,TCP,66,53227  >  443 [ACK] Seq=1 Ack=33 Win=2047 Len=0 TSval=1073995595 TSecr=4273030456
1.866404,192.168.1.9,104.254.148.166,TLSv1.2,97,Encrypted Alert
1.866557,192.168.1.9,104.254.148.166,TCP,66,"53227  >  443 [FIN, ACK] Seq=32 Ack=33 Win=2048 Len=0 TSval=1073995595 TSecr=4273030456"
1.88197,104.254.148.166,192.168.1.9,TCP,54,443  >  53229 [RST] Seq=33 Win=0 Len=0
1.881975,104.254.148.166,192.168.1.9,TCP,54,443  >  53229 [RST] Seq=33 Win=0 Len=0
1.89812,192.168.1.2,224.0.0.251,MDNS,193,"Standard query 0x0000 PTR _homekit._tcp.local, ""QU"" question PTR _companion-link._tcp.local, ""QU"" question PTR _airplay._tcp.local, ""QU"" question PTR _raop._tcp.local, ""QU"" question PTR _raop._tcp.local, ""QU"" question PTR _airplay._tcp.local, ""QU"" question PTR _sleep-proxy._udp.local, ""QU"" question OPT"
1.909989,104.254.148.166,192.168.1.9,TCP,54,443  >  53223 [RST] Seq=33 Win=0 Len=0
1.909995,104.254.148.166,192.168.1.9,TCP,54,443  >  53223 [RST] Seq=33 Win=0 Len=0
1.916397,104.254.148.166,192.168.1.9,TCP,54,443  >  53227 [RST] Seq=33 Win=0 Len=0
1.916403,104.254.148.166,192.168.1.9,TCP,54,443  >  53227 [RST] Seq=33 Win=0 Len=0
1.923584,192.168.1.9,169.60.125.155,TLSv1.2,97,Encrypted Alert
1.923794,192.168.1.9,169.60.125.155,TCP,66,"52817  >  443 [FIN, ACK] Seq=32 Ack=1 Win=2048 Len=0 TSval=1073995651 TSecr=182671293"
1.993291,192.168.1.9,192.168.1.2,MDNS,338,"Standard query response 0x0000 PTR Hans Gruber._companion-link._tcp.local SRV, cache flush 0 0 63636 Hans-Gruber.local TXT, cache flush TXT A, cache flush 192.168.1.9"
2.006969,169.60.125.155,192.168.1.9,TCP,66,"443  >  52817 [FIN, ACK] Seq=1 Ack=33 Win=7 Len=0 TSval=182791381 TSecr=1073995651"
2.00708,192.168.1.9,169.60.125.155,TCP,66,52817  >  443 [ACK] Seq=33 Ack=2 Win=2048 Len=0 TSval=1073995734 TSecr=182791381
2.183261,192.168.1.9,192.168.1.16,TCP,176,"63637  >  8009 [PSH, ACK] Seq=1 Ack=1 Win=2048 Len=110 TSval=1073995908 TSecr=2901519 [TCP segment of a reassembled PDU]"
2.189114,192.168.1.16,192.168.1.9,TCP,176,"8009  >  63637 [PSH, ACK] Seq=1 Ack=111 Win=294 Len=110 TSval=2902020 TSecr=1073995908 [TCP segment of a reassembled PDU]"
2.189233,192.168.1.9,192.168.1.16,TCP,66,63637  >  8009 [ACK] Seq=111 Ack=111 Win=2046 Len=0 TSval=1073995914 TSecr=2902020
2.71998,104.254.148.165,192.168.1.9,TLSv1.2,97,Encrypted Alert
2.720189,192.168.1.9,104.254.148.165,TCP,66,53087  >  443 [ACK] Seq=1 Ack=32 Win=2047 Len=0 TSval=1073996443 TSecr=4273027120
2.72059,192.168.1.9,104.254.148.165,TLSv1.2,97,Encrypted Alert
2.721017,192.168.1.9,104.254.148.165,TCP,66,"53087  >  443 [FIN, ACK] Seq=32 Ack=32 Win=2048 Len=0 TSval=1073996443 TSecr=4273027120"
2.724133,104.254.148.165,192.168.1.9,TCP,66,"443  >  53087 [FIN, ACK] Seq=32 Ack=1 Win=211 Len=0 TSval=4273027120 TSecr=1073986353"
2.724141,104.254.148.165,192.168.1.9,TCP,66,"[TCP Out-Of-Order] 443  >  53087 [FIN, ACK] Seq=32 Ack=1 Win=211 Len=0 TSval=4273027160 TSecr=1073986353"
2.72428,192.168.1.9,104.254.148.165,TCP,66,"[TCP Retransmission] 53087  >  443 [FIN, ACK] Seq=32 Ack=33 Win=2048 Len=0 TSval=1073996447 TSecr=4273027120"
2.72428,192.168.1.9,104.254.148.165,TCP,66,"[TCP Retransmission] 53087  >  443 [FIN, ACK] Seq=32 Ack=33 Win=2048 Len=0 TSval=1073996447 TSecr=4273027120"
2.769071,104.254.148.165,192.168.1.9,TCP,54,443  >  53087 [RST] Seq=32 Win=0 Len=0
2.769074,104.254.148.165,192.168.1.9,TCP,54,443  >  53087 [RST] Seq=32 Win=0 Len=0
2.769177,104.254.148.165,192.168.1.9,TCP,54,443  >  53087 [RST] Seq=33 Win=0 Len=0
2.769393,104.254.148.165,192.168.1.9,TCP,54,443  >  53087 [RST] Seq=33 Win=0 Len=0
3.127223,192.168.1.2,224.0.0.251,MDNS,423,"Standard query 0x0000 PTR _homekit._tcp.local, ""QM"" question PTR _companion-link._tcp.local, ""QM"" question PTR _raop._tcp.local, ""QM"" question PTR _airplay._tcp.local, ""QM"" question PTR _sleep-proxy._udp.local, ""QM"" question PTR Hans Gruber._companion-link._tcp.local PTR 28CFDA2A971C@yogi._raop._tcp.local PTR B817C2B7DABF@Living Room Apple TV._raop._tcp.local PTR yogi._airplay._tcp.local PTR Living Room Apple TV._airplay._tcp.local PTR 70-35-60-63.1 yogi._sleep-proxy._udp.local PTR 70-35-60-63.1 Living Room Apple TV._sleep-proxy._udp.local OPT"
3.707639,192.168.1.9,192.168.1.9,TCP,54,135  >  135 [SYN] Seq=0 Win=8192 Len=0
3.708053,192.168.1.9,192.168.1.9,TCP,54,[TCP Out-Of-Order] 135  >  135 [SYN] Seq=0 Win=8192 Len=0
3.708527,192.168.1.9,192.168.1.9,TCP,54,[TCP Out-Of-Order] 135  >  135 [SYN] Seq=0 Win=8192 Len=0
3.708866,192.168.1.9,192.168.1.9,TCP,54,[TCP Out-Of-Order] 135  >  135 [SYN] Seq=0 Win=8192 Len=0
3.709246,192.168.1.9,192.168.1.9,TCP,54,[TCP Out-Of-Order] 135  >  135 [SYN] Seq=0 Win=8192 Len=0
3.709594,192.168.1.9,192.168.1.9,TCP,54,[TCP Out-Of-Order] 135  >  135 [SYN] Seq=0 Win=8192 Len=0
3.709934,192.168.1.9,192.168.1.9,TCP,54,[TCP Out-Of-Order] 135  >  135 [SYN] Seq=0 Win=8192 Len=0
3.71037,192.168.1.9,192.168.1.9,TCP,54,[TCP Out-Of-Order] 135  >  135 [SYN] Seq=0 Win=8192 Len=0
3.710717,192.168.1.9,192.168.1.9,TCP,54,[TCP Retransmission] 135  >  135 [SYN] Seq=0 Win=8192 Len=0
3.711059,192.168.1.9,192.168.1.9,TCP,54,[TCP Retransmission] 135  >  135 [SYN] Seq=0 Win=8192 Len=0
3.711395,192.168.1.9,192.168.1.9,TCP,54,[TCP Retransmission] 135  >  135 [SYN] Seq=0 Win=8192 Len=0
3.711751,192.168.1.9,192.168.1.9,TCP,54,[TCP Retransmission] 135  >  135 [SYN] Seq=0 Win=8192 Len=0
3.71209,192.168.1.9,192.168.1.9,TCP,54,[TCP Retransmission] 135  >  135 [SYN] Seq=0 Win=8192 Len=0
3.71243,192.168.1.9,192.168.1.9,TCP,54,[TCP Retransmission] 135  >  135 [SYN] Seq=0 Win=8192 Len=0
3.712773,192.168.1.9,192.168.1.9,TCP,54,[TCP Retransmission] 135  >  135 [SYN] Seq=0 Win=8192 Len=0
3.713101,192.168.1.9,192.168.1.9,TCP,54,[TCP Retransmission] 135  >  135 [SYN] Seq=0 Win=8192 Len=0
3.713438,192.168.1.9,192.168.1.9,TCP,54,[TCP Retransmission] 135  >  135 [SYN] Seq=0 Win=8192 Len=0
3.713751,192.168.1.9,192.168.1.9,TCP,54,[TCP Retransmission] 135  >  135 [SYN] Seq=0 Win=8192 Len=0
3.714074,192.168.1.9,192.168.1.9,TCP,54,[TCP Retransmission] 135  >  135 [SYN] Seq=0 Win=8192 Len=0
3.714397,192.168.1.9,192.168.1.9,TCP,54,[TCP Retransmission] 135  >  135 [SYN] Seq=0 Win=8192 Len=0
3.714737,192.168.1.9,192.168.1.9,TCP,54,[TCP Retransmission] 135  >  135 [SYN] Seq=0 Win=8192 Len=0
3.715054,192.168.1.9,192.168.1.9,TCP,54,[TCP Retransmission] 135  >  135 [SYN] Seq=0 Win=8192 Len=0
3.715374,192.168.1.9,192.168.1.9,TCP,54,[TCP Retransmission] 135  >  135 [SYN] Seq=0 Win=8192 Len=0
3.715703,192.168.1.9,192.168.1.9,TCP,54,[TCP Retransmission] 135  >  135 [SYN] Seq=0 Win=8192 Len=0
3.716078,192.168.1.9,192.168.1.9,TCP,54,[TCP Retransmission] 135  >  135 [SYN] Seq=0 Win=8192 Len=0
3.716508,192.168.1.9,192.168.1.9,TCP,54,[TCP Retransmission] 135  >  135 [SYN] Seq=0 Win=8192 Len=0
3.716849,192.168.1.9,192.168.1.9,TCP,54,[TCP Retransmission] 135  >  135 [SYN] Seq=0 Win=8192 Len=0
3.717181,192.168.1.9,192.168.1.9,TCP,54,[TCP Retransmission] 135  >  135 [SYN] Seq=0 Win=8192 Len=0
3.717503,192.168.1.9,192.168.1.9,TCP,54,[TCP Retransmission] 135  >  135 [SYN] Seq=0 Win=8192 Len=0
3.717826,192.168.1.9,192.168.1.9,TCP,54,[TCP Retransmission] 135  >  135 [SYN] Seq=0 Win=8192 Len=0
3.718229,192.168.1.9,192.168.1.9,TCP,54,[TCP Retransmission] 135  >  135 [SYN] Seq=0 Win=8192 Len=0
3.718574,192.168.1.9,192.168.1.9,TCP,54,[TCP Retransmission] 135  >  135 [SYN] Seq=0 Win=8192 Len=0
3.718899,192.168.1.9,192.168.1.9,TCP,54,[TCP Retransmission] 135  >  135 [SYN] Seq=0 Win=8192 Len=0
3.719213,192.168.1.9,192.168.1.9,TCP,54,[TCP Retransmission] 135  >  135 [SYN] Seq=0 Win=8192 Len=0
3.719542,192.168.1.9,192.168.1.9,TCP,54,[TCP Retransmission] 135  >  135 [SYN] Seq=0 Win=8192 Len=0
3.719868,192.168.1.9,192.168.1.9,TCP,54,[TCP Retransmission] 135  >  135 [SYN] Seq=0 Win=8192 Len=0
3.720195,192.168.1.9,192.168.1.9,TCP,54,[TCP Retransmission] 135  >  135 [SYN] Seq=0 Win=8192 Len=0
3.72066,192.168.1.9,192.168.1.9,TCP,54,[TCP Retransmission] 135  >  135 [SYN] Seq=0 Win=8192 Len=0
3.720992,192.168.1.9,192.168.1.9,TCP,54,[TCP Retransmission] 135  >  135 [SYN] Seq=0 Win=8192 Len=0
3.721326,192.168.1.9,192.168.1.9,TCP,54,[TCP Retransmission] 135  >  135 [SYN] Seq=0 Win=8192 Len=0
3.721756,192.168.1.9,192.168.1.9,TCP,54,[TCP Retransmission] 135  >  135 [SYN] Seq=0 Win=8192 Len=0
3.722082,192.168.1.9,192.168.1.9,TCP,54,[TCP Retransmission] 135  >  135 [SYN] Seq=0 Win=8192 Len=0
3.722406,192.168.1.9,192.168.1.9,TCP,54,[TCP Retransmission] 135  >  135 [SYN] Seq=0 Win=8192 Len=0
3.722751,192.168.1.9,192.168.1.9,TCP,54,[TCP Retransmission] 135  >  135 [SYN] Seq=0 Win=8192 Len=0
3.723146,192.168.1.9,192.168.1.9,TCP,54,[TCP Retransmission] 135  >  135 [SYN] Seq=0 Win=8192 Len=0
3.723528,192.168.1.9,192.168.1.9,TCP,54,[TCP Retransmission] 135  >  135 [SYN] Seq=0 Win=8192 Len=0
3.723905,192.168.1.9,192.168.1.9,TCP,54,[TCP Retransmission] 135  >  135 [SYN] Seq=0 Win=8192 Len=0
3.724237,192.168.1.9,192.168.1.9,TCP,54,[TCP Retransmission] 135  >  135 [SYN] Seq=0 Win=8192 Len=0
3.724891,192.168.1.9,192.168.1.9,TCP,54,[TCP Retransmission] 135  >  135 [SYN] Seq=0 Win=8192 Len=0
3.725714,192.168.1.9,192.168.1.9,TCP,54,[TCP Retransmission] 135  >  135 [SYN] Seq=0 Win=8192 Len=0
3.72658,192.168.1.9,192.168.1.9,TCP,54,[TCP Retransmission] 135  >  135 [SYN] Seq=0 Win=8192 Len=0
3.728117,192.168.1.9,192.168.1.9,TCP,54,[TCP Retransmission] 135  >  135 [SYN] Seq=0 Win=8192 Len=0
3.729024,192.168.1.9,192.168.1.9,TCP,54,[TCP Retransmission] 135  >  135 [SYN] Seq=0 Win=8192 Len=0
3.729355,192.168.1.9,192.168.1.9,TCP,54,[TCP Retransmission] 135  >  135 [SYN] Seq=0 Win=8192 Len=0
3.729686,192.168.1.9,192.168.1.9,TCP,54,[TCP Retransmission] 135  >  135 [SYN] Seq=0 Win=8192 Len=0
3.73001,192.168.1.9,192.168.1.9,TCP,54,[TCP Retransmission] 135  >  135 [SYN] Seq=0 Win=8192 Len=0
3.730328,192.168.1.9,192.168.1.9,TCP,54,[TCP Retransmission] 135  >  135 [SYN] Seq=0 Win=8192 Len=0
3.730648,192.168.1.9,192.168.1.9,TCP,54,[TCP Retransmission] 135  >  135 [SYN] Seq=0 Win=8192 Len=0
3.730968,192.168.1.9,192.168.1.9,TCP,54,[TCP Retransmission] 135  >  135 [SYN] Seq=0 Win=8192 Len=0
3.731295,192.168.1.9,192.168.1.9,TCP,54,[TCP Retransmission] 135  >  135 [SYN] Seq=0 Win=8192 Len=0
3.731621,192.168.1.9,192.168.1.9,TCP,54,[TCP Retransmission] 135  >  135 [SYN] Seq=0 Win=8192 Len=0
3.73195,192.168.1.9,192.168.1.9,TCP,54,[TCP Retransmission] 135  >  135 [SYN] Seq=0 Win=8192 Len=0
3.732258,192.168.1.9,192.168.1.9,TCP,54,[TCP Retransmission] 135  >  135 [SYN] Seq=0 Win=8192 Len=0
3.73262,192.168.1.9,192.168.1.9,TCP,54,[TCP Retransmission] 135  >  135 [SYN] Seq=0 Win=8192 Len=0
3.732985,192.168.1.9,192.168.1.9,TCP,54,[TCP Retransmission] 135  >  135 [SYN] Seq=0 Win=8192 Len=0
3.73332,192.168.1.9,192.168.1.9,TCP,54,[TCP Retransmission] 135  >  135 [SYN] Seq=0 Win=8192 Len=0
3.733651,192.168.1.9,192.168.1.9,TCP,54,[TCP Retransmission] 135  >  135 [SYN] Seq=0 Win=8192 Len=0
3.741172,192.168.1.9,192.168.1.9,TCP,54,[TCP Retransmission] 135  >  135 [SYN] Seq=0 Win=8192 Len=0
3.74148,192.168.1.9,192.168.1.9,TCP,54,[TCP Retransmission] 135  >  135 [SYN] Seq=0 Win=8192 Len=0
3.741878,192.168.1.9,192.168.1.9,TCP,54,[TCP Retransmission] 135  >  135 [SYN] Seq=0 Win=8192 Len=0
3.742213,192.168.1.9,192.168.1.9,TCP,54,[TCP Retransmission] 135  >  135 [SYN] Seq=0 Win=8192 Len=0
3.7432,192.168.1.9,192.168.1.9,TCP,54,[TCP Retransmission] 135  >  135 [SYN] Seq=0 Win=8192 Len=0
3.743364,74.125.142.189,192.168.1.9,UDP,83,443  >  51451 Len=41
3.743544,192.168.1.9,192.168.1.9,TCP,54,[TCP Retransmission] 135  >  135 [SYN] Seq=0 Win=8192 Len=0
3.743884,192.168.1.9,192.168.1.9,TCP,54,[TCP Retransmission] 135  >  135 [SYN] Seq=0 Win=8192 Len=0
3.744207,192.168.1.9,192.168.1.9,TCP,54,[TCP Retransmission] 135  >  135 [SYN] Seq=0 Win=8192 Len=0
3.744528,192.168.1.9,192.168.1.9,TCP,54,[TCP Retransmission] 135  >  135 [SYN] Seq=0 Win=8192 Len=0
3.744849,192.168.1.9,192.168.1.9,TCP,54,[TCP Retransmission] 135  >  135 [SYN] Seq=0 Win=8192 Len=0
3.745173,192.168.1.9,192.168.1.9,TCP,54,[TCP Retransmission] 135  >  135 [SYN] Seq=0 Win=8192 Len=0
3.745487,192.168.1.9,192.168.1.9,TCP,54,[TCP Retransmission] 135  >  135 [SYN] Seq=0 Win=8192 Len=0
3.745814,192.168.1.9,192.168.1.9,TCP,54,[TCP Retransmission] 135  >  135 [SYN] Seq=0 Win=8192 Len=0
3.74614,192.168.1.9,192.168.1.9,TCP,54,[TCP Retransmission] 135  >  135 [SYN] Seq=0 Win=8192 Len=0
3.746461,192.168.1.9,192.168.1.9,TCP,54,[TCP Retransmission] 135  >  135 [SYN] Seq=0 Win=8192 Len=0
3.74676,192.168.1.9,192.168.1.9,TCP,54,[TCP Retransmission] 135  >  135 [SYN] Seq=0 Win=8192 Len=0
3.747126,192.168.1.9,192.168.1.9,TCP,54,[TCP Retransmission] 135  >  135 [SYN] Seq=0 Win=8192 Len=0
3.747442,192.168.1.9,192.168.1.9,TCP,54,[TCP Retransmission] 135  >  135 [SYN] Seq=0 Win=8192 Len=0
3.747762,192.168.1.9,192.168.1.9,TCP,54,[TCP Retransmission] 135  >  135 [SYN] Seq=0 Win=8192 Len=0
3.748082,192.168.1.9,192.168.1.9,TCP,54,[TCP Retransmission] 135  >  135 [SYN] Seq=0 Win=8192 Len=0
3.748405,192.168.1.9,192.168.1.9,TCP,54,[TCP Retransmission] 135  >  135 [SYN] Seq=0 Win=8192 Len=0
3.748829,192.168.1.9,192.168.1.9,TCP,54,[TCP Retransmission] 135  >  135 [SYN] Seq=0 Win=8192 Len=0
3.749216,192.168.1.9,192.168.1.9,TCP,54,[TCP Retransmission] 135  >  135 [SYN] Seq=0 Win=8192 Len=0
3.753181,192.168.1.9,192.168.1.9,TCP,54,[TCP Retransmission] 135  >  135 [SYN] Seq=0 Win=8192 Len=0
3.753512,192.168.1.9,192.168.1.9,TCP,54,[TCP Retransmission] 135  >  135 [SYN] Seq=0 Win=8192 Len=0
3.753842,192.168.1.9,192.168.1.9,TCP,54,[TCP Retransmission] 135  >  135 [SYN] Seq=0 Win=8192 Len=0
3.754165,192.168.1.9,192.168.1.9,TCP,54,[TCP Retransmission] 135  >  135 [SYN] Seq=0 Win=8192 Len=0
3.754498,192.168.1.9,192.168.1.9,TCP,54,[TCP Retransmission] 135  >  135 [SYN] Seq=0 Win=8192 Len=0
3.754873,192.168.1.9,192.168.1.9,TCP,54,[TCP Retransmission] 135  >  135 [SYN] Seq=0 Win=8192 Len=0
3.755202,192.168.1.9,192.168.1.9,TCP,54,[TCP Retransmission] 135  >  135 [SYN] Seq=0 Win=8192 Len=0
3.755545,192.168.1.9,192.168.1.9,TCP,54,[TCP Retransmission] 135  >  135 [SYN] Seq=0 Win=8192 Len=0
3.755856,192.168.1.9,192.168.1.9,TCP,54,[TCP Retransmission] 135  >  135 [SYN] Seq=0 Win=8192 Len=0
3.756349,192.168.1.9,192.168.1.9,TCP,54,[TCP Retransmission] 135  >  135 [SYN] Seq=0 Win=8192 Len=0
3.757364,192.168.1.9,192.168.1.9,TCP,54,[TCP Retransmission] 135  >  135 [SYN] Seq=0 Win=8192 Len=0
3.757698,192.168.1.9,192.168.1.9,TCP,54,[TCP Retransmission] 135  >  135 [SYN] Seq=0 Win=8192 Len=0
3.758022,192.168.1.9,192.168.1.9,TCP,54,[TCP Retransmission] 135  >  135 [SYN] Seq=0 Win=8192 Len=0
3.758347,192.168.1.9,192.168.1.9,TCP,54,[TCP Retransmission] 135  >  135 [SYN] Seq=0 Win=8192 Len=0
3.758671,192.168.1.9,192.168.1.9,TCP,54,[TCP Retransmission] 135  >  135 [SYN] Seq=0 Win=8192 Len=0
3.758998,192.168.1.9,192.168.1.9,TCP,54,[TCP Retransmission] 135  >  135 [SYN] Seq=0 Win=8192 Len=0
3.75932,192.168.1.9,192.168.1.9,TCP,54,[TCP Retransmission] 135  >  135 [SYN] Seq=0 Win=8192 Len=0
3.759645,192.168.1.9,192.168.1.9,TCP,54,[TCP Retransmission] 135  >  135 [SYN] Seq=0 Win=8192 Len=0
3.759972,192.168.1.9,192.168.1.9,TCP,54,[TCP Retransmission] 135  >  135 [SYN] Seq=0 Win=8192 Len=0
3.760294,192.168.1.9,192.168.1.9,TCP,54,[TCP Retransmission] 135  >  135 [SYN] Seq=0 Win=8192 Len=0
3.760603,192.168.1.9,192.168.1.9,TCP,54,[TCP Retransmission] 135  >  135 [SYN] Seq=0 Win=8192 Len=0
3.761081,192.168.1.9,192.168.1.9,TCP,54,[TCP Retransmission] 135  >  135 [SYN] Seq=0 Win=8192 Len=0
3.761466,192.168.1.9,192.168.1.9,TCP,54,[TCP Retransmission] 135  >  135 [SYN] Seq=0 Win=8192 Len=0
3.761809,192.168.1.9,192.168.1.9,TCP,54,[TCP Retransmission] 135  >  135 [SYN] Seq=0 Win=8192 Len=0
3.762114,192.168.1.9,192.168.1.9,TCP,54,[TCP Retransmission] 135  >  135 [SYN] Seq=0 Win=8192 Len=0
3.762454,192.168.1.9,192.168.1.9,TCP,54,[TCP Retransmission] 135  >  135 [SYN] Seq=0 Win=8192 Len=0
3.762776,192.168.1.9,192.168.1.9,TCP,54,[TCP Retransmission] 135  >  135 [SYN] Seq=0 Win=8192 Len=0
3.763094,192.168.1.9,192.168.1.9,TCP,54,[TCP Retransmission] 135  >  135 [SYN] Seq=0 Win=8192 Len=0
3.763392,192.168.1.9,192.168.1.9,TCP,54,[TCP Retransmission] 135  >  135 [SYN] Seq=0 Win=8192 Len=0
3.763722,192.168.1.9,192.168.1.9,TCP,54,[TCP Retransmission] 135  >  135 [SYN] Seq=0 Win=8192 Len=0
3.764045,192.168.1.9,192.168.1.9,TCP,54,[TCP Retransmission] 135  >  135 [SYN] Seq=0 Win=8192 Len=0
3.764354,192.168.1.9,192.168.1.9,TCP,54,[TCP Retransmission] 135  >  135 [SYN] Seq=0 Win=8192 Len=0
3.764779,192.168.1.9,192.168.1.9,TCP,54,[TCP Retransmission] 135  >  135 [SYN] Seq=0 Win=8192 Len=0
3.768977,192.168.1.9,74.125.142.189,UDP,71,51451  >  443 Len=29
3.771715,192.168.1.9,192.168.1.9,TCP,54,[TCP Retransmission] 135  >  135 [SYN] Seq=0 Win=8192 Len=0
3.772083,192.168.1.9,192.168.1.9,TCP,54,[TCP Retransmission] 135  >  135 [SYN] Seq=0 Win=8192 Len=0
3.7725,192.168.1.9,192.168.1.9,TCP,54,[TCP Retransmission] 135  >  135 [SYN] Seq=0 Win=8192 Len=0
3.772922,192.168.1.9,192.168.1.9,TCP,54,[TCP Retransmission] 135  >  135 [SYN] Seq=0 Win=8192 Len=0
3.788505,192.168.1.9,192.168.1.9,TCP,54,[TCP Retransmission] 135  >  135 [SYN] Seq=0 Win=8192 Len=0
3.788843,192.168.1.9,192.168.1.9,TCP,54,[TCP Retransmission] 135  >  135 [SYN] Seq=0 Win=8192 Len=0
3.789181,192.168.1.9,192.168.1.9,TCP,54,[TCP Retransmission] 135  >  135 [SYN] Seq=0 Win=8192 Len=0
3.789777,192.168.1.9,192.168.1.9,TCP,54,[TCP Retransmission] 135  >  135 [SYN] Seq=0 Win=8192 Len=0
3.790745,192.168.1.9,192.168.1.9,TCP,54,[TCP Retransmission] 135  >  135 [SYN] Seq=0 Win=8192 Len=0
3.791093,192.168.1.9,192.168.1.9,TCP,54,[TCP Retransmission] 135  >  135 [SYN] Seq=0 Win=8192 Len=0
3.791413,192.168.1.9,192.168.1.9,TCP,54,[TCP Retransmission] 135  >  135 [SYN] Seq=0 Win=8192 Len=0
3.791739,192.168.1.9,192.168.1.9,TCP,54,[TCP Retransmission] 135  >  135 [SYN] Seq=0 Win=8192 Len=0
3.792126,192.168.1.9,192.168.1.9,TCP,54,[TCP Retransmission] 135  >  135 [SYN] Seq=0 Win=8192 Len=0
3.792463,192.168.1.9,192.168.1.9,TCP,54,[TCP Retransmission] 135  >  135 [SYN] Seq=0 Win=8192 Len=0
3.79279,192.168.1.9,192.168.1.9,TCP,54,[TCP Retransmission] 135  >  135 [SYN] Seq=0 Win=8192 Len=0
3.793122,192.168.1.9,192.168.1.9,TCP,54,[TCP Retransmission] 135  >  135 [SYN] Seq=0 Win=8192 Len=0
3.793452,192.168.1.9,192.168.1.9,TCP,54,[TCP Retransmission] 135  >  135 [SYN] Seq=0 Win=8192 Len=0
3.793778,192.168.1.9,192.168.1.9,TCP,54,[TCP Retransmission] 135  >  135 [SYN] Seq=0 Win=8192 Len=0
3.794112,192.168.1.9,192.168.1.9,TCP,54,[TCP Retransmission] 135  >  135 [SYN] Seq=0 Win=8192 Len=0
3.794432,192.168.1.9,192.168.1.9,TCP,54,[TCP Retransmission] 135  >  135 [SYN] Seq=0 Win=8192 Len=0
3.794764,192.168.1.9,192.168.1.9,TCP,54,[TCP Retransmission] 135  >  135 [SYN] Seq=0 Win=8192 Len=0
3.795087,192.168.1.9,192.168.1.9,TCP,54,[TCP Retransmission] 135  >  135 [SYN] Seq=0 Win=8192 Len=0
3.795431,192.168.1.9,192.168.1.9,TCP,54,[TCP Retransmission] 135  >  135 [SYN] Seq=0 Win=8192 Len=0
3.795754,192.168.1.9,192.168.1.9,TCP,54,[TCP Retransmission] 135  >  135 [SYN] Seq=0 Win=8192 Len=0
3.796066,192.168.1.9,192.168.1.9,TCP,54,[TCP Retransmission] 135  >  135 [SYN] Seq=0 Win=8192 Len=0
3.802798,192.168.1.9,192.168.1.9,TCP,54,[TCP Retransmission] 135  >  135 [SYN] Seq=0 Win=8192 Len=0
3.803137,192.168.1.9,192.168.1.9,TCP,54,[TCP Retransmission] 135  >  135 [SYN] Seq=0 Win=8192 Len=0
3.803469,192.168.1.9,192.168.1.9,TCP,54,[TCP Retransmission] 135  >  135 [SYN] Seq=0 Win=8192 Len=0
3.803911,192.168.1.9,192.168.1.9,TCP,54,[TCP Retransmission] 135  >  135 [SYN] Seq=0 Win=8192 Len=0
3.81062,192.168.1.9,192.168.1.9,TCP,54,[TCP Retransmission] 135  >  135 [SYN] Seq=0 Win=8192 Len=0
3.810964,192.168.1.9,192.168.1.9,TCP,54,[TCP Retransmission] 135  >  135 [SYN] Seq=0 Win=8192 Len=0
3.811279,192.168.1.9,192.168.1.9,TCP,54,[TCP Retransmission] 135  >  135 [SYN] Seq=0 Win=8192 Len=0
3.821549,192.168.1.9,192.168.1.9,TCP,54,[TCP Retransmission] 135  >  135 [SYN] Seq=0 Win=8192 Len=0
3.821939,192.168.1.9,192.168.1.9,TCP,54,[TCP Retransmission] 135  >  135 [SYN] Seq=0 Win=8192 Len=0
3.822341,192.168.1.9,192.168.1.9,TCP,54,[TCP Retransmission] 135  >  135 [SYN] Seq=0 Win=8192 Len=0
3.822668,192.168.1.9,192.168.1.9,TCP,54,[TCP Retransmission] 135  >  135 [SYN] Seq=0 Win=8192 Len=0
3.823069,192.168.1.9,192.168.1.9,TCP,54,[TCP Retransmission] 135  >  135 [SYN] Seq=0 Win=8192 Len=0
3.82357,192.168.1.9,192.168.1.9,TCP,54,[TCP Retransmission] 135  >  135 [SYN] Seq=0 Win=8192 Len=0
3.82391,192.168.1.9,192.168.1.9,TCP,54,[TCP Retransmission] 135  >  135 [SYN] Seq=0 Win=8192 Len=0
3.824238,192.168.1.9,192.168.1.9,TCP,54,[TCP Retransmission] 135  >  135 [SYN] Seq=0 Win=8192 Len=0
3.824569,192.168.1.9,192.168.1.9,TCP,54,[TCP Retransmission] 135  >  135 [SYN] Seq=0 Win=8192 Len=0
3.824887,192.168.1.9,192.168.1.9,TCP,54,[TCP Retransmission] 135  >  135 [SYN] Seq=0 Win=8192 Len=0
3.825223,192.168.1.9,192.168.1.9,TCP,54,[TCP Retransmission] 135  >  135 [SYN] Seq=0 Win=8192 Len=0
3.825547,192.168.1.9,192.168.1.9,TCP,54,[TCP Retransmission] 135  >  135 [SYN] Seq=0 Win=8192 Len=0
3.825858,192.168.1.9,192.168.1.9,TCP,54,[TCP Retransmission] 135  >  135 [SYN] Seq=0 Win=8192 Len=0
3.826194,192.168.1.9,192.168.1.9,TCP,54,[TCP Retransmission] 135  >  135 [SYN] Seq=0 Win=8192 Len=0
3.826518,192.168.1.9,192.168.1.9,TCP,54,[TCP Retransmission] 135  >  135 [SYN] Seq=0 Win=8192 Len=0
3.826842,192.168.1.9,192.168.1.9,TCP,54,[TCP Retransmission] 135  >  135 [SYN] Seq=0 Win=8192 Len=0
3.827147,192.168.1.9,192.168.1.9,TCP,54,[TCP Retransmission] 135  >  135 [SYN] Seq=0 Win=8192 Len=0
3.827654,192.168.1.9,192.168.1.9,TCP,54,[TCP Retransmission] 135  >  135 [SYN] Seq=0 Win=8192 Len=0
3.827985,192.168.1.9,192.168.1.9,TCP,54,[TCP Retransmission] 135  >  135 [SYN] Seq=0 Win=8192 Len=0
3.828314,192.168.1.9,192.168.1.9,TCP,54,[TCP Retransmission] 135  >  135 [SYN] Seq=0 Win=8192 Len=0
3.828631,192.168.1.9,192.168.1.9,TCP,54,[TCP Retransmission] 135  >  135 [SYN] Seq=0 Win=8192 Len=0
3.828949,192.168.1.9,192.168.1.9,TCP,54,[TCP Retransmission] 135  >  135 [SYN] Seq=0 Win=8192 Len=0
3.82928,192.168.1.9,192.168.1.9,TCP,54,[TCP Retransmission] 135  >  135 [SYN] Seq=0 Win=8192 Len=0
3.829598,192.168.1.9,192.168.1.9,TCP,54,[TCP Retransmission] 135  >  135 [SYN] Seq=0 Win=8192 Len=0
3.82998,192.168.1.9,192.168.1.9,TCP,54,[TCP Retransmission] 135  >  135 [SYN] Seq=0 Win=8192 Len=0
3.830437,192.168.1.9,192.168.1.9,TCP,54,[TCP Retransmission] 135  >  135 [SYN] Seq=0 Win=8192 Len=0
3.830914,192.168.1.9,192.168.1.9,TCP,54,[TCP Retransmission] 135  >  135 [SYN] Seq=0 Win=8192 Len=0
3.831266,192.168.1.9,192.168.1.9,TCP,54,[TCP Retransmission] 135  >  135 [SYN] Seq=0 Win=8192 Len=0
3.831583,192.168.1.9,192.168.1.9,TCP,54,[TCP Retransmission] 135  >  135 [SYN] Seq=0 Win=8192 Len=0
3.8319,192.168.1.9,192.168.1.9,TCP,54,[TCP Retransmission] 135  >  135 [SYN] Seq=0 Win=8192 Len=0
3.832227,192.168.1.9,192.168.1.9,TCP,54,[TCP Retransmission] 135  >  135 [SYN] Seq=0 Win=8192 Len=0
3.832576,192.168.1.9,192.168.1.9,TCP,54,[TCP Retransmission] 135  >  135 [SYN] Seq=0 Win=8192 Len=0
3.832898,192.168.1.9,192.168.1.9,TCP,54,[TCP Retransmission] 135  >  135 [SYN] Seq=0 Win=8192 Len=0
3.83323,192.168.1.9,192.168.1.9,TCP,54,[TCP Retransmission] 135  >  135 [SYN] Seq=0 Win=8192 Len=0
3.833564,192.168.1.9,192.168.1.9,TCP,54,[TCP Retransmission] 135  >  135 [SYN] Seq=0 Win=8192 Len=0
3.833891,192.168.1.9,192.168.1.9,TCP,54,[TCP Retransmission] 135  >  135 [SYN] Seq=0 Win=8192 Len=0
3.834222,192.168.1.9,192.168.1.9,TCP,54,[TCP Retransmission] 135  >  135 [SYN] Seq=0 Win=8192 Len=0
3.83458,192.168.1.9,192.168.1.9,TCP,54,[TCP Retransmission] 135  >  135 [SYN] Seq=0 Win=8192 Len=0
3.834918,192.168.1.9,192.168.1.9,TCP,54,[TCP Retransmission] 135  >  135 [SYN] Seq=0 Win=8192 Len=0
3.835243,192.168.1.9,192.168.1.9,TCP,54,[TCP Retransmission] 135  >  135 [SYN] Seq=0 Win=8192 Len=0
3.835573,192.168.1.9,192.168.1.9,TCP,54,[TCP Retransmission] 135  >  135 [SYN] Seq=0 Win=8192 Len=0
3.835897,192.168.1.9,192.168.1.9,TCP,54,[TCP Retransmission] 135  >  135 [SYN] Seq=0 Win=8192 Len=0
3.836235,192.168.1.9,192.168.1.9,TCP,54,[TCP Retransmission] 135  >  135 [SYN] Seq=0 Win=8192 Len=0
3.836559,192.168.1.9,192.168.1.9,TCP,54,[TCP Retransmission] 135  >  135 [SYN] Seq=0 Win=8192 Len=0
3.837207,192.168.1.9,192.168.1.9,TCP,54,[TCP Retransmission] 135  >  135 [SYN] Seq=0 Win=8192 Len=0
3.837604,192.168.1.9,192.168.1.9,TCP,54,[TCP Retransmission] 135  >  135 [SYN] Seq=0 Win=8192 Len=0
3.83794,192.168.1.9,192.168.1.9,TCP,54,[TCP Retransmission] 135  >  135 [SYN] Seq=0 Win=8192 Len=0
3.838351,192.168.1.9,192.168.1.9,TCP,54,[TCP Retransmission] 135  >  135 [SYN] Seq=0 Win=8192 Len=0
3.838763,192.168.1.9,192.168.1.9,TCP,54,[TCP Retransmission] 135  >  135 [SYN] Seq=0 Win=8192 Len=0
3.83941,192.168.1.9,192.168.1.9,TCP,54,[TCP Retransmission] 135  >  135 [SYN] Seq=0 Win=8192 Len=0
3.839558,192.168.1.9,192.168.1.9,TCP,54,[TCP Retransmission] 135  >  135 [SYN] Seq=0 Win=8192 Len=0
3.839959,192.168.1.9,192.168.1.9,TCP,54,[TCP Retransmission] 135  >  135 [SYN] Seq=0 Win=8192 Len=0
3.840323,192.168.1.9,192.168.1.9,TCP,54,[TCP Retransmission] 135  >  135 [SYN] Seq=0 Win=8192 Len=0
3.840859,192.168.1.9,192.168.1.9,TCP,54,[TCP Retransmission] 135  >  135 [SYN] Seq=0 Win=8192 Len=0
3.847213,192.168.1.9,192.168.1.9,TCP,54,[TCP Retransmission] 135  >  135 [SYN] Seq=0 Win=8192 Len=0
3.847532,192.168.1.9,192.168.1.9,TCP,54,[TCP Retransmission] 135  >  135 [SYN] Seq=0 Win=8192 Len=0
3.847857,192.168.1.9,192.168.1.9,TCP,54,[TCP Retransmission] 135  >  135 [SYN] Seq=0 Win=8192 Len=0
3.848191,192.168.1.9,192.168.1.9,TCP,54,[TCP Retransmission] 135  >  135 [SYN] Seq=0 Win=8192 Len=0
3.848518,192.168.1.9,192.168.1.9,TCP,54,[TCP Retransmission] 135  >  135 [SYN] Seq=0 Win=8192 Len=0
3.848845,192.168.1.9,192.168.1.9,TCP,54,[TCP Retransmission] 135  >  135 [SYN] Seq=0 Win=8192 Len=0
3.849171,192.168.1.9,192.168.1.9,TCP,54,[TCP Retransmission] 135  >  135 [SYN] Seq=0 Win=8192 Len=0
3.849497,192.168.1.9,192.168.1.9,TCP,54,[TCP Retransmission] 135  >  135 [SYN] Seq=0 Win=8192 Len=0
3.849833,192.168.1.9,192.168.1.9,TCP,54,[TCP Retransmission] 135  >  135 [SYN] Seq=0 Win=8192 Len=0
3.850151,192.168.1.9,192.168.1.9,TCP,54,[TCP Retransmission] 135  >  135 [SYN] Seq=0 Win=8192 Len=0
3.850478,192.168.1.9,192.168.1.9,TCP,54,[TCP Retransmission] 135  >  135 [SYN] Seq=0 Win=8192 Len=0
3.850861,192.168.1.9,192.168.1.9,TCP,54,[TCP Retransmission] 135  >  135 [SYN] Seq=0 Win=8192 Len=0
3.851194,192.168.1.9,192.168.1.9,TCP,54,[TCP Retransmission] 135  >  135 [SYN] Seq=0 Win=8192 Len=0
3.85152,192.168.1.9,192.168.1.9,TCP,54,[TCP Retransmission] 135  >  135 [SYN] Seq=0 Win=8192 Len=0
3.851841,192.168.1.9,192.168.1.9,TCP,54,[TCP Retransmission] 135  >  135 [SYN] Seq=0 Win=8192 Len=0
3.852169,192.168.1.9,192.168.1.9,TCP,54,[TCP Retransmission] 135  >  135 [SYN] Seq=0 Win=8192 Len=0
3.852491,192.168.1.9,192.168.1.9,TCP,54,[TCP Retransmission] 135  >  135 [SYN] Seq=0 Win=8192 Len=0
3.8528,192.168.1.9,192.168.1.9,TCP,54,[TCP Retransmission] 135  >  135 [SYN] Seq=0 Win=8192 Len=0
3.853275,192.168.1.9,192.168.1.9,TCP,54,[TCP Retransmission] 135  >  135 [SYN] Seq=0 Win=8192 Len=0
3.853592,192.168.1.9,192.168.1.9,TCP,54,[TCP Retransmission] 135  >  135 [SYN] Seq=0 Win=8192 Len=0
3.853913,192.168.1.9,192.168.1.9,TCP,54,[TCP Retransmission] 135  >  135 [SYN] Seq=0 Win=8192 Len=0
3.854228,192.168.1.9,192.168.1.9,TCP,54,[TCP Retransmission] 135  >  135 [SYN] Seq=0 Win=8192 Len=0
3.854626,192.168.1.9,192.168.1.9,TCP,54,[TCP Retransmission] 135  >  135 [SYN] Seq=0 Win=8192 Len=0
3.855125,192.168.1.9,192.168.1.9,TCP,54,[TCP Retransmission] 135  >  135 [SYN] Seq=0 Win=8192 Len=0
3.855454,192.168.1.9,192.168.1.9,TCP,54,[TCP Retransmission] 135  >  135 [SYN] Seq=0 Win=8192 Len=0
3.855767,192.168.1.9,192.168.1.9,TCP,54,[TCP Retransmission] 135  >  135 [SYN] Seq=0 Win=8192 Len=0
3.856099,192.168.1.9,192.168.1.9,TCP,54,[TCP Retransmission] 135  >  135 [SYN] Seq=0 Win=8192 Len=0
3.856492,192.168.1.9,192.168.1.9,TCP,54,[TCP Retransmission] 135  >  135 [SYN] Seq=0 Win=8192 Len=0
3.856823,192.168.1.9,192.168.1.9,TCP,54,[TCP Retransmission] 135  >  135 [SYN] Seq=0 Win=8192 Len=0
3.857153,192.168.1.9,192.168.1.9,TCP,54,[TCP Retransmission] 135  >  135 [SYN] Seq=0 Win=8192 Len=0
3.857474,192.168.1.9,192.168.1.9,TCP,54,[TCP Retransmission] 135  >  135 [SYN] Seq=0 Win=8192 Len=0
3.857799,192.168.1.9,192.168.1.9,TCP,54,[TCP Retransmission] 135  >  135 [SYN] Seq=0 Win=8192 Len=0
3.858124,192.168.1.9,192.168.1.9,TCP,54,[TCP Retransmission] 135  >  135 [SYN] Seq=0 Win=8192 Len=0
3.858441,192.168.1.9,192.168.1.9,TCP,54,[TCP Retransmission] 135  >  135 [SYN] Seq=0 Win=8192 Len=0
3.858758,192.168.1.9,192.168.1.9,TCP,54,[TCP Retransmission] 135  >  135 [SYN] Seq=0 Win=8192 Len=0
3.859077,192.168.1.9,192.168.1.9,TCP,54,[TCP Retransmission] 135  >  135 [SYN] Seq=0 Win=8192 Len=0
3.859413,192.168.1.9,192.168.1.9,TCP,54,[TCP Retransmission] 135  >  135 [SYN] Seq=0 Win=8192 Len=0
3.859704,192.168.1.9,192.168.1.9,TCP,54,[TCP Retransmission] 135  >  135 [SYN] Seq=0 Win=8192 Len=0
3.86003,192.168.1.9,192.168.1.9,TCP,54,[TCP Retransmission] 135  >  135 [SYN] Seq=0 Win=8192 Len=0
3.86317,192.168.1.9,192.168.1.9,TCP,54,[TCP Retransmission] 135  >  135 [SYN] Seq=0 Win=8192 Len=0
3.863492,192.168.1.9,192.168.1.9,TCP,54,[TCP Retransmission] 135  >  135 [SYN] Seq=0 Win=8192 Len=0
3.863837,192.168.1.9,192.168.1.9,TCP,54,[TCP Retransmission] 135  >  135 [SYN] Seq=0 Win=8192 Len=0
3.864167,192.168.1.9,192.168.1.9,TCP,54,[TCP Retransmission] 135  >  135 [SYN] Seq=0 Win=8192 Len=0
3.864494,192.168.1.9,192.168.1.9,TCP,54,[TCP Retransmission] 135  >  135 [SYN] Seq=0 Win=8192 Len=0
3.86481,192.168.1.9,192.168.1.9,TCP,54,[TCP Retransmission] 135  >  135 [SYN] Seq=0 Win=8192 Len=0
3.865143,192.168.1.9,192.168.1.9,TCP,54,[TCP Retransmission] 135  >  135 [SYN] Seq=0 Win=8192 Len=0
3.865464,192.168.1.9,192.168.1.9,TCP,54,[TCP Retransmission] 135  >  135 [SYN] Seq=0 Win=8192 Len=0
3.865787,192.168.1.9,192.168.1.9,TCP,54,[TCP Retransmission] 135  >  135 [SYN] Seq=0 Win=8192 Len=0
3.866115,192.168.1.9,192.168.1.9,TCP,54,[TCP Retransmission] 135  >  135 [SYN] Seq=0 Win=8192 Len=0
3.866443,192.168.1.9,192.168.1.9,TCP,54,[TCP Retransmission] 135  >  135 [SYN] Seq=0 Win=8192 Len=0
3.866765,192.168.1.9,192.168.1.9,TCP,54,[TCP Retransmission] 135  >  135 [SYN] Seq=0 Win=8192 Len=0
3.867093,192.168.1.9,192.168.1.9,TCP,54,[TCP Retransmission] 135  >  135 [SYN] Seq=0 Win=8192 Len=0
3.867418,192.168.1.9,192.168.1.9,TCP,54,[TCP Retransmission] 135  >  135 [SYN] Seq=0 Win=8192 Len=0
3.86774,192.168.1.9,192.168.1.9,TCP,54,[TCP Retransmission] 135  >  135 [SYN] Seq=0 Win=8192 Len=0
3.868065,192.168.1.9,192.168.1.9,TCP,54,[TCP Retransmission] 135  >  135 [SYN] Seq=0 Win=8192 Len=0
3.868364,192.168.1.9,192.168.1.9,TCP,54,[TCP Retransmission] 135  >  135 [SYN] Seq=0 Win=8192 Len=0
3.868769,192.168.1.9,192.168.1.9,TCP,54,[TCP Retransmission] 135  >  135 [SYN] Seq=0 Win=8192 Len=0
3.869105,192.168.1.9,192.168.1.9,TCP,54,[TCP Retransmission] 135  >  135 [SYN] Seq=0 Win=8192 Len=0
3.869434,192.168.1.9,192.168.1.9,TCP,54,[TCP Retransmission] 135  >  135 [SYN] Seq=0 Win=8192 Len=0
3.86976,192.168.1.9,192.168.1.9,TCP,54,[TCP Retransmission] 135  >  135 [SYN] Seq=0 Win=8192 Len=0
3.870093,192.168.1.9,192.168.1.9,TCP,54,[TCP Retransmission] 135  >  135 [SYN] Seq=0 Win=8192 Len=0
3.87042,192.168.1.9,192.168.1.9,TCP,54,[TCP Retransmission] 135  >  135 [SYN] Seq=0 Win=8192 Len=0
3.870767,192.168.1.9,192.168.1.9,TCP,54,[TCP Retransmission] 135  >  135 [SYN] Seq=0 Win=8192 Len=0
3.871167,192.168.1.9,192.168.1.9,TCP,54,[TCP Retransmission] 135  >  135 [SYN] Seq=0 Win=8192 Len=0
3.871589,192.168.1.9,192.168.1.9,TCP,54,[TCP Retransmission] 135  >  135 [SYN] Seq=0 Win=8192 Len=0
3.872057,192.168.1.9,192.168.1.9,TCP,54,[TCP Retransmission] 135  >  135 [SYN] Seq=0 Win=8192 Len=0
3.87239,192.168.1.9,192.168.1.9,TCP,54,[TCP Retransmission] 135  >  135 [SYN] Seq=0 Win=8192 Len=0
3.872771,192.168.1.9,192.168.1.9,TCP,54,[TCP Retransmission] 135  >  135 [SYN] Seq=0 Win=8192 Len=0
3.887594,192.168.1.9,192.168.1.9,TCP,54,[TCP Retransmission] 135  >  135 [SYN] Seq=0 Win=8192 Len=0
3.887949,192.168.1.9,192.168.1.9,TCP,54,[TCP Retransmission] 135  >  135 [SYN] Seq=0 Win=8192 Len=0
3.888347,192.168.1.9,192.168.1.9,TCP,54,[TCP Retransmission] 135  >  135 [SYN] Seq=0 Win=8192 Len=0
3.888676,192.168.1.9,192.168.1.9,TCP,54,[TCP Retransmission] 135  >  135 [SYN] Seq=0 Win=8192 Len=0
3.889002,192.168.1.9,192.168.1.9,TCP,54,[TCP Retransmission] 135  >  135 [SYN] Seq=0 Win=8192 Len=0
3.889328,192.168.1.9,192.168.1.9,TCP,54,[TCP Retransmission] 135  >  135 [SYN] Seq=0 Win=8192 Len=0
3.889646,192.168.1.9,192.168.1.9,TCP,54,[TCP Retransmission] 135  >  135 [SYN] Seq=0 Win=8192 Len=0
3.889974,192.168.1.9,192.168.1.9,TCP,54,[TCP Retransmission] 135  >  135 [SYN] Seq=0 Win=8192 Len=0
3.890307,192.168.1.9,192.168.1.9,TCP,54,[TCP Retransmission] 135  >  135 [SYN] Seq=0 Win=8192 Len=0
3.890634,192.168.1.9,192.168.1.9,TCP,54,[TCP Retransmission] 135  >  135 [SYN] Seq=0 Win=8192 Len=0
3.890942,192.168.1.9,192.168.1.9,TCP,54,[TCP Retransmission] 135  >  135 [SYN] Seq=0 Win=8192 Len=0
3.891275,192.168.1.9,192.168.1.9,TCP,54,[TCP Retransmission] 135  >  135 [SYN] Seq=0 Win=8192 Len=0
3.8916,192.168.1.9,192.168.1.9,TCP,54,[TCP Retransmission] 135  >  135 [SYN] Seq=0 Win=8192 Len=0
3.891923,192.168.1.9,192.168.1.9,TCP,54,[TCP Retransmission] 135  >  135 [SYN] Seq=0 Win=8192 Len=0
3.892249,192.168.1.9,192.168.1.9,TCP,54,[TCP Retransmission] 135  >  135 [SYN] Seq=0 Win=8192 Len=0
3.892561,192.168.1.9,192.168.1.9,TCP,54,[TCP Retransmission] 135  >  135 [SYN] Seq=0 Win=8192 Len=0
3.893025,192.168.1.9,192.168.1.9,TCP,54,[TCP Retransmission] 135  >  135 [SYN] Seq=0 Win=8192 Len=0
3.893354,192.168.1.9,192.168.1.9,TCP,54,[TCP Retransmission] 135  >  135 [SYN] Seq=0 Win=8192 Len=0
3.893679,192.168.1.9,192.168.1.9,TCP,54,[TCP Retransmission] 135  >  135 [SYN] Seq=0 Win=8192 Len=0
3.894006,192.168.1.9,192.168.1.9,TCP,54,[TCP Retransmission] 135  >  135 [SYN] Seq=0 Win=8192 Len=0
3.894323,192.168.1.9,192.168.1.9,TCP,54,[TCP Retransmission] 135  >  135 [SYN] Seq=0 Win=8192 Len=0
3.894649,192.168.1.9,192.168.1.9,TCP,54,[TCP Retransmission] 135  >  135 [SYN] Seq=0 Win=8192 Len=0
3.894951,192.168.1.9,192.168.1.9,TCP,54,[TCP Retransmission] 135  >  135 [SYN] Seq=0 Win=8192 Len=0
3.895341,192.168.1.9,192.168.1.9,TCP,54,[TCP Retransmission] 135  >  135 [SYN] Seq=0 Win=8192 Len=0
3.895777,192.168.1.9,192.168.1.9,TCP,54,[TCP Retransmission] 135  >  135 [SYN] Seq=0 Win=8192 Len=0
3.896109,192.168.1.9,192.168.1.9,TCP,54,[TCP Retransmission] 135  >  135 [SYN] Seq=0 Win=8192 Len=0
3.896435,192.168.1.9,192.168.1.9,TCP,54,[TCP Retransmission] 135  >  135 [SYN] Seq=0 Win=8192 Len=0
3.896757,192.168.1.9,192.168.1.9,TCP,54,[TCP Retransmission] 135  >  135 [SYN] Seq=0 Win=8192 Len=0
3.897079,192.168.1.9,192.168.1.9,TCP,54,[TCP Retransmission] 135  >  135 [SYN] Seq=0 Win=8192 Len=0
3.897402,192.168.1.9,192.168.1.9,TCP,54,[TCP Retransmission] 135  >  135 [SYN] Seq=0 Win=8192 Len=0
3.897723,192.168.1.9,192.168.1.9,TCP,54,[TCP Retransmission] 135  >  135 [SYN] Seq=0 Win=8192 Len=0
3.898043,192.168.1.9,192.168.1.9,TCP,54,[TCP Retransmission] 135  >  135 [SYN] Seq=0 Win=8192 Len=0
3.898363,192.168.1.9,192.168.1.9,TCP,54,[TCP Retransmission] 135  >  135 [SYN] Seq=0 Win=8192 Len=0
3.898683,192.168.1.9,192.168.1.9,TCP,54,[TCP Retransmission] 135  >  135 [SYN] Seq=0 Win=8192 Len=0
3.899002,192.168.1.9,192.168.1.9,TCP,54,[TCP Retransmission] 135  >  135 [SYN] Seq=0 Win=8192 Len=0
3.899324,192.168.1.9,192.168.1.9,TCP,54,[TCP Retransmission] 135  >  135 [SYN] Seq=0 Win=8192 Len=0
3.899643,192.168.1.9,192.168.1.9,TCP,54,[TCP Retransmission] 135  >  135 [SYN] Seq=0 Win=8192 Len=0
